Title,Year,TMDb ID,TMDb Rating,Overview,IMDb ID,IMDb Rating,Runtime (min),Genre
Godzilla Minus One,2023,940721,7.6,"In postwar Japan, Godzilla brings new devastation to an already scorched landscape. With no military intervention or government help in sight, the survivors must join together in the face of despair and fight back against an unrelenting horror.",tt23289160,7.7,124.0,"Action, Adventure, Drama"
Nosferatu,2024,426063,6.714,"A gothic tale of obsession between a haunted young woman and the terrifying vampire infatuated with her, causing untold horror in its wake.",tt5040012,7.3,132.0,"Fantasy, Horror, Mystery"
The Substance,2024,933260,7.146,"A fading celebrity decides to use a black market drug, a cell-replicating substance that temporarily creates a younger, better version of herself.",tt17526714,7.3,141.0,"Drama, Horror, Sci-Fi"
A Quiet Place Part II,2021,520763,7.473,"Following the events at home, the Abbott family now face the terrors of the outside world. Forced to venture into the unknown, they realize that the creatures that hunt by sound are not the only threats that lurk beyond the sand path.",tt8332922,7.2,97.0,"Drama, Horror, Sci-Fi"
The Menu,2022,593643,7.17,"A young couple travels to a remote island to eat at an exclusive restaurant where the chef has prepared a lavish menu, with some shocking surprises.",tt9764362,7.2,107.0,"Comedy, Horror, Thriller"
The Invisible Man,2020,570670,7.11,"When Cecilia's abusive ex takes his own life and leaves her his fortune, she suspects his death was a hoax. As a series of coincidences turn lethal, Cecilia works to prove that she is being hunted by someone nobody can see.",tt1051906,7.1,124.0,"Drama, Horror, Mystery"
Werewolf by Night,2022,894205,6.979,"On a dark and somber night, a secret cabal of monster hunters emerge from the shadows and gather at the foreboding Bloodstone Temple following the death of their leader. In a strange and macabre memorial to the leader’s life, the attendees are thrust into a mysterious and deadly competition for a powerful relic—a hunt that will ultimately bring them face to face with a dangerous monster.",tt15318872,7.1,52.0,"Action, Adventure, Drama"
Alien: Romulus,2024,945961,7.203,"While scavenging the deep ends of a derelict space station, a group of young space colonizers come face to face with the most terrifying life form in the universe.",tt18412256,7.1,119.0,"Horror, Sci-Fi, Thriller"
Red Rooms,2023,912480,7.085,"The high-profile case of serial killer Ludovic Chevalier has just gone to trial, and Kelly-Anne is obsessed. When reality blurs with her morbid fantasies, she goes down a dark path to seek the final piece of the case’s puzzle.",tt22207786,7.1,118.0,"Crime, Horror, Mystery"
Talk to Me,2023,1008042,7.161,"When a group of friends discover how to conjure spirits using an embalmed hand, they become hooked on the new thrill, until one of them goes too far and unleashes terrifying supernatural forces.",tt10638522,7.1,95.0,"Horror, Thriller"
Strange Darling,2024,1029281,7.0,Nothing is what it seems when a twisted one-night stand spirals into a serial killer’s vicious murder spree.,tt22375054,7.1,97.0,"Horror, Thriller"
Humanist Vampire Seeking Consenting Suicidal Person,2023,988402,7.4,"Sasha is a young vampire with a serious problem: she's too sensitive to kill. When her exasperated parents cut off her blood supply, Sasha's life is in jeopardy. Luckily, she meets Paul, a lonely teenager with suicidal tendencies who is willing to give his life to save hers. But their friendly agreement soon becomes a nocturnal quest to fulfill Paul's last wishes before day breaks.",tt24216998,7.0,90.0,"Comedy, Drama, Fantasy"
Barbarian,2022,913290,6.831,"In town for a job interview, a young woman arrives at her Airbnb late at night only to find that it has been mistakenly double-booked and a strange man is already staying there. Against her better judgement, she decides to stay the night anyway.",tt15791034,7.0,102.0,"Horror, Mystery, Thriller"
The Innocents,2021,660942,6.921,"Four children become friends during the summer holidays, and out of sight of the adults they discover they have hidden powers. While exploring their newfound abilities in the nearby forests and playgrounds, their innocent play takes a dark turn and strange things begin to happen.",tt4028464,7.0,117.0,"Drama, Fantasy, Horror"
Heretic,2024,1138194,7.048,"Two young missionaries are forced to prove their faith when they knock on the wrong door and are greeted by a diabolical Mr. Reed, becoming ensnared in his deadly game of cat-and-mouse.",tt28015403,7.0,111.0,"Horror, Thriller"
Pearl,2022,949423,7.2,"Trapped on her family’s isolated farm, Pearl must tend to her ailing father under the bitter and overbearing watch of her devout mother. Lusting for a glamorous life like she’s seen in the movies, Pearl’s ambitions, temptations, and repressions collide.",tt18925334,7.0,103.0,"Drama, Horror, Thriller"
Last Night in Soho,2021,576845,7.3,"A young girl, passionate about fashion design, is mysteriously able to enter the 1960s where she encounters her idol, a dazzling wannabe singer. But 1960s London is not what it seems, and time seems to be falling apart with shady consequences.",tt9639470,7.0,116.0,"Drama, Horror, Mystery"
Stree 2,2024,1112426,6.595,"After the events of Stree, the town of Chanderi is being haunted again. This time, women are mysteriously abducted by a terrifying headless entity. Once again, it's up to Vicky and his friends to save their town and loved ones.",tt27510174,7.0,147.0,"Comedy, Horror"
Late Night with the Devil,2024,938614,7.13,"A live broadcast of a late-night talk show in 1977 goes horribly wrong, unleashing evil into the nation's living rooms.",tt14966898,7.0,93.0,Horror
Exhuma,2024,838209,7.565,"After tracing the origin of a disturbing supernatural affliction to a wealthy family's ancestral gravesite, a team of paranormal experts relocates the remains—and soon discovers what happens to those who dare to mess with the wrong grave.",tt27802490,6.9,134.0,"Drama, Horror, Mystery"
The Trip,2021,760747,6.683,"A dysfunctional couple head to a remote lakeside cabin under the guise of reconnecting, but each has secret designs to kill the other. Before they can carry out their respective plans, unexpected visitors arrive and the couple is faced with a greater danger than anything they could have plotted.",tt13109952,6.9,113.0,"Action, Comedy, Horror"
The Black Phone,2022,756999,7.573,"Finney Blake, a shy but clever 13-year-old boy, is abducted by a sadistic killer and trapped in a soundproof basement where screaming is of little use. When a disconnected phone on the wall begins to ring, Finney discovers that he can hear the voices of the killer’s previous victims. And they are dead set on making sure that what happened to them doesn’t happen to Finney.",tt7144666,6.9,103.0,"Horror, Mystery, Thriller"
Unicorn Wars,2022,587092,7.56,"An army of bear cubs train and indoctrinate young recruits for the war against the unicorns, which threatens the safety of the cubs. Brothers Bluey and Tubby, along with a group of inexperienced cadets, are sent on a dangerous mission to save the Magic Forest, where the unicorns live, and start a terrible battle.",tt10483152,6.9,92.0,"Animation, Action, Comedy"
When Evil Lurks,2023,744857,7.266,"Residents of a small rural town discover that a demon is about to be born among them. They desperately try to escape before the evil is born, but it may be too late.",tt16300962,6.9,99.0,Horror
Bones and All,2022,791177,7.1,"Abandoned by her father, a young woman embarks on a thousand-mile odyssey through the backroads of America where she meets a disenfranchised drifter. But despite their best efforts, all roads lead back to their terrifying pasts and to a final stand that will determine whether their love can survive their otherness.",tt10168670,6.8,131.0,"Drama, Horror, Romance"
Caddo Lake,2024,863873,7.275,"When an 8-year-old girl mysteriously vanishes on Caddo Lake, a series of past deaths and disappearances begin to link together, forever altering a broken family’s history.",tt15552142,6.8,103.0,"Drama, Mystery, Sci-Fi"
Nope,2022,762504,6.845,"Residents in a lonely gulch of inland California bear witness to an uncanny, chilling discovery.",tt10954984,6.8,130.0,"Horror, Mystery, Sci-Fi"
Mad God,2021,846867,6.851,"A figure known as ""The Assassin"" descends from the heavens into a nightmarish pit full of monsters, titans, and cruelty.",tt15090124,6.8,83.0,"Animation, Fantasy, Horror"
Speak No Evil,2024,1114513,7.253,"When an American family is invited to spend the weekend at the idyllic country estate of a charming British family they befriended on vacation, what begins as a dream holiday soon warps into a snarled psychological nightmare.",tt27534307,6.8,110.0,"Drama, Horror, Thriller"
The House,2022,926899,7.027,"Across different eras, a poor family, an anxious developer and a fed-up landlady become tied to the same mysterious house in this animated dark comedy.",tt11703050,6.8,97.0,"Animation, Comedy, Drama"
Fear Street: 1978,2021,591274,7.2,"In 1978, two rival groups at Camp Nightwing must band together to solve a terrifying mystery when horrors from their towns' history come alive.",tt9701940,6.7,109.0,"Drama, Horror, Mystery"
Oddity,2024,1216191,6.7,"After the brutal murder of her twin sister, Darcy goes after those responsible by using haunted items as her tools for revenge.",tt26470109,6.7,98.0,"Horror, Thriller"
Saint Maud,2020,575776,6.6,"Having recently found God, self-effacing young nurse Maud arrives at a plush home to care for Amanda, a hedonistic dancer left frail from a chronic illness. When a chance encounter with a former colleague throws up hints of a dark past, it becomes clear there is more to sweet Maud than meets the eye.",tt7557108,6.7,84.0,"Drama, Horror, Mystery"
Run,2020,546121,7.247,"Chloe, a teenager who is confined to a wheelchair, is homeschooled by her mother, Diane. Chloe soon becomes suspicious of her mother and begins to suspect that she may be harboring a dark secret.",tt8633478,6.7,90.0,"Drama, Horror, Mystery"
Smile 2,2024,1100782,6.593,"About to embark on a new world tour, global pop sensation Skye Riley begins experiencing increasingly terrifying and inexplicable events. Overwhelmed by the escalating horrors and the pressures of fame, Skye is forced to face her dark past to regain control of her life before it spirals out of control.",tt29268110,6.7,127.0,"Horror, Mystery, Thriller"
Fresh,2022,787752,7.0,"Frustrated by scrolling dating apps only to end up on lame, tedious dates, Noa takes a chance by giving her number to the awkwardly charming Steve after a produce-section meet-cute at the grocery store.",tt13403046,6.7,114.0,"Horror, Thriller"
The Coffee Table,2023,1056380,6.987,"Jesus and María are a couple going through a difficult time in their relationship. Nevertheless, they have just become parents. To shape their new life, they decide to buy a new coffee table. A decision that will change their existence.",tt21874760,6.7,89.0,"Comedy, Drama, Horror"
Satan's Slaves 2: Communion,2022,925786,6.9,"After moving from their home to an apartment building, a new terror awaits Rini’s family.",tt16915972,6.7,119.0,"Drama, Horror, Mystery"
Saw X,2023,951491,7.212,"Between the events of 'Saw' and 'Saw II', a sick and desperate John Kramer travels to Mexico for a risky and experimental medical procedure in hopes of a miracle cure for his cancer, only to discover the entire operation is a scam to defraud the most vulnerable. Armed with a newfound purpose, the infamous serial killer returns to his work, turning the tables on the con artists in his signature visceral way through devious, deranged, and ingenious traps.",tt21807222,6.6,118.0,"Horror, Mystery, Thriller"
Beetlejuice Beetlejuice,2024,917496,7.0,"After a family tragedy, three generations of the Deetz family return home to Winter River. Still haunted by Betelgeuse, Lydia's life is turned upside down when her teenage daughter, Astrid, accidentally opens the portal to the Afterlife.",tt2049403,6.6,105.0,"Comedy, Fantasy, Horror"
Home for Rent,2023,977177,6.868,"When her good tenants go bad, a landlord finds herself terrorized by a cult that seemingly has her husband enthralled — and her daughter in its sights.",tt26547790,6.6,124.0,"Horror, Mystery, Thriller"
Some Like It Rare,2021,730769,6.426,"Sophie and Vincent’s small butcher shop is on the brink of bankruptcy and their marriage is falling apart. Their lives are turned upside down when Vincent accidentally kills a vegan activist who vandalized their shop. Overwhelmed and terrified of being accused of murder, their only solution is to get rid of the body by turning it into ham. To their surprise the ham is so popular that it may save their business… that is if they’re ready to keep “hunting""!",tt12887770,6.6,87.0,"Comedy, Horror"
All the Moons,2020,776670,7.4,"During the final throes of the last Carlist war, a little girl is rescued from an orphanage by a mysterious woman who lives deep inside the forest.",tt11892482,6.6,102.0,"Drama, Fantasy, Horror"
Longlegs,2024,1226578,6.6,"FBI Agent Lee Harker is a gifted new recruit assigned to the unsolved case of an elusive serial killer. As the case takes complex turns, unearthing evidence of the occult, Harker discovers a personal connection to the merciless killer and must race against time to stop him before he claims the lives of another innocent family.",tt23468450,6.6,101.0,"Crime, Horror, Thriller"
The Devil's Bath,2024,931944,6.6,"In 1750 Austria, a deeply religious woman named Agnes has just married her beloved, but her mind and heart soon grow heavy as her life becomes a long list of chores and expectations. Day after day, she is increasingly trapped in a murky and lonely path leading to evil thoughts, until the possibility of committing a shocking act of violence seems like the only way out of her inner prison.",tt29141112,6.6,121.0,"Drama, History, Horror"
The Pale Blue Eye,2022,800815,6.838,"West Point, New York, 1830. When a cadet at the burgeoning military academy is found hanged with his heart cut out, the top brass summons former New York City constable Augustus Landor to investigate. While attempting to solve this grisly mystery, the reluctant detective engages the help of one of the cadets: a strange but brilliant young fellow by the name of Edgar Allan Poe.",tt14138650,6.6,128.0,"Crime, Horror, Mystery"
Sleep,2023,964592,6.717,"Hyun-su and Soo-jin have just gotten married. Seemingly out of nowhere, he starts talking in his sleep. 'Someone’s inside.' From that night forward, whenever he falls asleep, he transforms into someone else with no recollection of the night before. Soo-jin is overwhelmed with anxiety that he’d hurt her family while she sleeps and can barely sleep a wink because of this irrational fear. Despite sleep treatment, Hyun-su’s sleepwalking only intensifies, and she begins to feel that her unborn child may be in danger...",tt8209702,6.6,95.0,"Horror, Mystery, Thriller"
The Hunt,2020,514847,6.629,"Twelve strangers wake up in a clearing. They don't know where they are—or how they got there. In the shadow of a dark internet conspiracy theory, ruthless elitists gather at a remote location to hunt humans for sport. But their master plan is about to be derailed when one of the hunted turns the tables on her pursuers.",tt8244784,6.6,90.0,"Action, Horror, Thriller"
Fear Street: 1666,2021,591275,7.1,"In 1666, a colonial town is gripped by a hysterical witch-hunt that has deadly consequences for centuries to come, and it's up to teenagers in 1994 to finally put an end to their town's curse, before it's too late.",tt9701942,6.6,114.0,"Horror, Mystery"
Speak No Evil,2022,833339,6.645,A Danish family visits a Dutch family they met on a holiday. What was supposed to be an idyllic weekend slowly starts unraveling as the Danes try to stay polite in the face of unpleasantness.,tt14253846,6.6,97.0,"Drama, Horror, Mystery"
Bloody Hell,2020,696822,6.473,"A man with a mysterious past flees the country to escape his own personal hell... only to arrive somewhere much worse. In an effort to survive this new horror, he turns to his personified conscience.",tt9772374,6.6,93.0,"Comedy, Horror, Mystery"
Bulbbul,2020,714338,6.536,"A child bride grows up to be an enigmatic woman presiding over her household, harboring a painful past as supernatural murders of men plague her village.",tt12393526,6.6,94.0,"Drama, Horror, Mystery"
Spontaneous,2020,604578,6.8,"When students in their high school begin inexplicably exploding (literally), seniors Mara and Dylan struggle to survive in a world where each moment may be their last.",tt5774062,6.5,101.0,"Comedy, Drama, Horror"
Shaitaan,2024,1187619,6.254,"Kabir and his family's fun weekend retreat takes terrifying turn when an intruder takes over the control of the  body of his teenage daughter, putting her at the mercy of his increasingly sinister orders.",tt27744786,6.5,132.0,"Drama, Horror, Thriller"
Oxygen,2021,471498,6.623,"A woman wakes in a cryogenic chamber with no recollection of how she got there, and must find a way out before running out of air.",tt6341832,6.5,100.0,"Drama, Fantasy, Sci-Fi"
Smile,2022,882598,6.662,"After witnessing a bizarre, traumatic incident involving a patient, Dr. Rose Cotter starts experiencing frightening occurrences that she can't explain.",tt15474916,6.5,115.0,"Horror, Mystery, Thriller"
The Sadness,2021,776797,6.792,"A young couple is pushed to the limits of sanity as they attempt to be reunited amid the chaos of a pandemic outbreak. The streets erupt into violence and depravity, as those infected are driven to enact the most cruel and ghastly things imaginable.",tt13872248,6.5,99.0,Horror
Titane,2021,630240,6.3,"A woman with a metal plate in her head from a childhood car accident embarks on a bizarre journey, bringing her into contact with a firefighter who's reunited with his missing son after 10 years.",tt10944760,6.5,108.0,"Drama, Horror, Sci-Fi"
Evil Dead Rise,2023,713704,6.931,"A reunion between two estranged sisters gets cut short by the rise of flesh-possessing demons, thrusting them into a primal battle for survival as they face the most nightmarish version of family imaginable.",tt13345606,6.5,96.0,Horror
Totally Killer,2023,974931,6.8,"When the infamous ""Sweet Sixteen Killer"" returns 35 years after his first murder spree to claim another victim, 17-year-old Jamie accidentally travels back in time to 1987, determined to stop the killer before he can start.",tt11426232,6.5,106.0,"Comedy, Horror, Sci-Fi"
Bull,2021,821792,6.413,"Ten years after he was last seen, a vicious mob enforcer returns home to find his son and methodically track down the gang that double-crossed him. His quest for revenge soon leads to a savage showdown between his wife and her mob boss father.",tt13266998,6.5,88.0,"Crime, Thriller"
X,2022,760104,6.74,"In 1979, a group of young filmmakers set out to make an adult film in rural Texas, but when their reclusive, elderly hosts catch them in the act, the cast find themselves fighting for their lives.",tt13560574,6.5,105.0,"Horror, Mystery, Thriller"
The First Omen,2024,437342,6.868,"When a young American woman is sent to Rome to begin a life of service to the church, she encounters a darkness that causes her to question her own faith and uncovers a terrifying conspiracy that hopes to bring about the birth of evil incarnate.",tt5672290,6.5,119.0,Horror
Vicious Fun,2021,728054,6.54,"Joel, a caustic 1980s film critic for a national horror magazine, finds himself unwittingly trapped in a self-help group for serial killers. With no other choice, Joel attempts to blend in with his homicidal surroundings or risk becoming the next victim.",tt11778118,6.5,101.0,"Comedy, Horror"
Swallow,2020,586461,6.615,"Hunter, a newly pregnant housewife, finds herself increasingly compelled to consume dangerous objects. As her husband and his family tighten their control over her life, she must confront the dark secret behind her new obsession.",tt8372298,6.5,94.0,"Drama, Thriller"
I'm Thinking of Ending Things,2020,500840,6.582,Nothing is as it seems when a woman experiencing misgivings about her new boyfriend joins him on a road trip to meet his parents at their remote farm.,tt7939766,6.5,134.0,"Drama, Thriller"
Host,2020,723072,6.481,"Six friends hire a medium to hold a séance via Zoom during lockdown — but they get far more than they bargained for as things quickly go wrong. When an evil spirit starts invading their homes, they begin to realise they might not survive the night.",tt12749596,6.5,57.0,"Horror, Mystery"
The Medium,2021,745881,7.0,"A shaman's family learn that their goddess is supposedly controlling one of them. However, their lives take a frightening turn when they realise the goddess has nothing to do with the possession.",tt13446168,6.5,130.0,"Drama, Horror, Mystery"
Abigail,2024,1111873,6.759,"A group of criminals kidnap a teenage ballet dancer, the daughter of a notorious gang leader, in order to obtain a ransom of $50 million, but over time, they discover that she is not just an ordinary girl. After the kidnappers begin to diminish, one by one, they discover, to their increasing horror, that they are locked inside with no normal little girl.",tt27489557,6.5,109.0,"Horror, Thriller"
Possessor,2020,435615,6.4,"Tasya Vos, an elite corporate assassin, uses brain-implant technology to take control of other people’s bodies to terminate high profile targets. As she sinks deeper into her latest assignment, Vos becomes trapped inside a mind that threatens to obliterate her.",tt5918982,6.5,103.0,"Horror, Mystery, Sci-Fi"
Scream VI,2023,934433,6.994,"Following the latest Ghostface killings, the four survivors leave Woodsboro behind and start a fresh chapter.",tt17663992,6.4,122.0,"Horror, Mystery, Thriller"
Final Cut,2022,852438,6.778,Things go badly for a small film crew shooting a low-budget zombie movie when they are attacked by real zombies.,tt14317880,6.4,112.0,"Comedy, Horror"
You Won't Be Alone,2022,883083,6.652,"In an isolated mountain village in 19th century Macedonia, a young feral witch accidentally kills a peasant. She assumes the peasant's shape to see what life is like in her skin, igniting a deep seated curiosity to experience life inside the bodies of others.",tt8296030,6.4,108.0,"Drama, Fantasy, Horror"
Deadstream,2022,886083,6.212,"A disgraced internet personality attempts to win back his followers by livestreaming one night alone in a haunted house. But when he accidentally pisses off a vengeful spirit, his big comeback event becomes a real-time fight for his life.",tt12788488,6.4,87.0,"Comedy, Horror"
The Night House,2021,547565,6.59,"Reeling from the unexpected death of her husband, Beth is left alone in the lakeside home he built for her. Soon she begins to uncover her recently deceased husband's disturbing secrets.",tt9731534,6.4,107.0,"Horror, Mystery, Thriller"
Bloody Oranges,2021,833404,6.032,"Simultaneously, a retired couple overwhelmed by debt tries to win a dance contest, as the minister of economy is suspected of tax evasion, and a teenage girl encounters a sexual maniac, while a young lawyer attempts to climb the social ladder. When the shoe drops, the winner won’t necessarily be the one we expected.",tt13274576,6.4,105.0,"Comedy, Crime, Drama"
Smoking Causes Coughing,2022,872709,6.1,"After a devastating battle against a diabolical turtle, a team of five avengers — known as the ""Tobacco Force"" — is sent on a mandatory retreat to strengthen their decaying group cohesion. Their sojourn goes wonderfully well until Lézardin, Emperor of Evil, decides to annihilate planet Earth.",tt15471560,6.4,77.0,"Comedy, Horror, Sci-Fi"
Nefarious,2023,913673,6.8,"On the day of his scheduled execution, a convicted serial killer gets a psychiatric evaluation during which he claims he is a demon, and further claims that before their time is over, the psychiatrist will commit three murders of his own.",tt14537248,6.4,97.0,"Horror, Thriller"
Wendell & Wild,2022,511817,6.676,Two demon brothers enlist the aid of Kat Elliot — a tough teen with a load of guilt — to summon them to the Land of the Living. But what Kat demands in return leads to a brilliantly bizarre and comedic adventure like no other.,tt5181830,6.4,105.0,"Animation, Adventure, Comedy"
History of the Occult,2020,649294,6.844,"During the last broadcast of 60 Minutes Before Midnight, the most watched journalistic program on television, Adrián Marcato could expose a conspiracy and link the government to a obscure secret society.",tt11310884,6.4,82.0,Horror
The Spine of Night,2021,795522,5.97,"In this ultra-violent, fantasy epic, ancient dark magic falls into sinister hands and unleashes ages of suffering onto mankind. A group of heroes from different eras and cultures must band together in order to defeat it at all costs.",tt3885422,6.4,93.0,"Animation, Action, Adventure"
The Mortuary Collection,2020,524216,6.724,"In the phantasmagorical town of Raven's End, a misguided young girl takes refuge in a decrepit old mortuary. The eccentric undertaker chronicles the strange history of the town through a series of twisted tales, each more terrifying than the last, but the young girl's world is unhinged when she discovers that the final story... is her own.",tt7781432,6.4,108.0,"Fantasy, Horror"
His House,2020,575774,6.416,"After making a harrowing escape from war-torn South Sudan, a young refugee couple struggle to adjust to their new life in a small English town that has an unspeakable evil lurking beneath the surface.",tt8508734,6.4,93.0,"Drama, Horror, Thriller"
