Title,Year,TMDb ID,TMDb Rating,Overview,IMDb ID,IMDb Rating,Runtime (min),Genre
M,2023,829361,7.5,"Deep in a secluded forest, Marko lives in isolation under the watchful eye of his overprotective father, who is determined to keep his young son safe from the Evil Ones. Deeply lonely, and increasingly curious about the outside world, Marko yearns to uncover the secrets of life beyond the forest and begins venturing further from home. But after a cruel turn of events grants his wish sooner than he ever imagined, Marko is forced to flee and embark on a grim journey filled with unknown dangers and a glimpse into a world forever changed.",tt11076026,6.0,99.0,"Adventure, Drama, Sci-Fi"
Haunted Mansion,2023,616747,6.479,A woman and her son enlist a motley crew of so-called spiritual experts to help rid their home of supernatural squatters.,tt1695843,6.0,123.0,"Comedy, Drama, Family"
Project Wolf Hunting,2022,799379,6.384,"While under heavily armed guard, the dangerous convicts aboard a cargo ship unite in a coordinated escape attempt that soon escalates into a bloody, all-out riot. But as the fugitives continue their brutal campaign of terror, they soon discover that not even the most vicious among them is safe from the horror they unknowingly unleashed from the darkness below deck.",tt15575470,6.0,122.0,"Action, Crime, Horror"
Relic,2020,539181,6.087,"When elderly mother Edna inexplicably vanishes, her daughter rushes to the family's decaying home, finding clues of her increasing dementia scattered around the house in her absence.",tt9072352,6.0,89.0,"Drama, Horror, Mystery"
The Cleansing Hour,2020,608994,6.403,Two millennial entrepreneurs stage elaborate fake exorcisms on social media until one of their girlfriends becomes possessed by a demon.,tt8009906,6.0,94.0,"Drama, Fantasy, Horror"
The Lodge,2020,474764,6.109,"When a father is forced to abruptly depart for work, he leaves his children, Aidan and Mia, at their holiday home in the care of his new girlfriend, Grace. Isolated and alone, a blizzard traps them inside the lodge as terrifying events summon specters from Grace's dark past.",tt7347846,6.0,108.0,"Drama, Horror, Mystery"
Don't Breathe 2,2021,482373,7.045,"The Blind Man has been hiding out for several years in an isolated cabin and has taken in and raised a young girl orphaned from a devastating house fire. Their quiet life together is shattered when a group of criminals kidnap the girl, forcing the Blind Man to leave his safe haven to save her.",tt6246322,6.0,98.0,"Action, Crime, Horror"
Ghost Mansion,2021,842033,7.275,A horror webtoon writer journeys to a shabby apartment building in search of ideas. The building's caretaker tells him about multiple strange events that happened throughout the building's history.,tt14895216,6.0,106.0,"Horror, Mystery, Thriller"
Becky,2020,601844,6.3,A teenager's weekend at a lake house with her father takes a turn for the worse when a group of convicts wreaks havoc on their lives.,tt10314450,6.0,93.0,"Action, Crime, Drama"
Come True,2020,515454,5.951,"Looking for an escape from her recurring nightmares, 18-year-old Sarah submits to a university sleep study, but soon realizes she's become the conduit to a frightening new discovery.",tt7026488,6.0,105.0,"Horror, Sci-Fi"
Teddy,2020,712123,6.272,"In a rural French town, twenty-something Teddy is scratched by an unknown beast and slowly undergoes frightening changes.",tt10469804,6.0,88.0,"Comedy, Drama, Horror"
My Heart Can't Beat Unless You Tell It To,2020,690248,5.932,"Dwight and his sister Jessie reach a crossroads over what to do about their little brother Thomas, a sickly child with a mysterious affliction.",tt11084432,6.0,90.0,"Drama, Horror"
Unhinged,2020,625568,6.441,"Rachel is a divorced single mother whose bad day gets even worse. She's running late to drop her son off at school when she honks her horn impatiently at a fellow driver during rush-hour traffic. After an exchange of words, she soon realizes that the mysterious man is following her and her young son in his truck. A case of road rage quickly escalates, at horrifyingly psychotic proportions, into full-blown terror as Rachel discovers the psychopath's sinister plan for revenge. He is single-mindedly determined to teach her a deadly lesson.",tt10059518,6.0,90.0,"Action, Thriller"
May the Devil Take You Too,2020,632885,7.132,"Two years after escaping from demonic terror, a young woman is still haunted by unnatural vision. The dangers that await her and her friends are increasingly threatening.",tt10776270,6.0,110.0,"Fantasy, Horror, Mystery"
Gatlopp,2022,893338,6.0,"Four friends get together for a nostalgic evening of fun and games after a decade of absence, which takes a dark turn.",tt11615616,5.9,80.0,"Comedy, Drama, Horror"
Apartment 7A,2024,807339,6.174,"A struggling young dancer finds herself drawn in by dark forces when a peculiar, well-connected older couple promise her a shot at fame.",tt14371860,5.9,107.0,"Horror, Thriller"
Uncle Peckerhead,2020,667154,5.925,"When a punk band scores their first tour, life on the road proves tough when they are joined by a man-eating demon as a roadie.",tt11695654,5.9,97.0,"Comedy, Horror, Music"
La Abuela (The Grandmother),2022,661791,5.868,"Susana leaves her life in Paris, where she works as a model, and returns to Madrid to take care of her grandmother Pilar.",tt11807888,5.9,100.0,Horror
Resurrection,2022,872497,6.055,"A woman's carefully constructed life is upended when an unwelcome shadow from her past returns, forcing her to confront the monster she's evaded for two decades.",tt11540726,5.9,103.0,"Crime, Drama, Horror"
Antlers,2021,516329,6.228,"A small-town Oregon teacher and her brother, the local sheriff, discover a young student is harbouring a dangerous secret that could have frightening consequences.",tt7740510,5.9,99.0,"Drama, Horror, Mystery"
The Last Matinee,2020,739291,6.055,"In 1993, spectators at the last screening of a horror film at a downtown cinema fall one by one into the hands of a sadistic and ruthless killer.",tt13049760,5.9,88.0,"Horror, Thriller"
The Cursed: Dead Man's Prey,2021,724885,7.485,"Following a brutal murder case, the police are baffled to find out that the assailant, whose body was found on the scene with the victim, had already been dead for three months. Meanwhile, journalist Jin-hee sets up a live interview with an anonymous caller claiming he is the true killer behind the mysterious murder. When the man announces three more murders will occur in the hands of the undead, Jin-hee must face the sinister forces beyond understanding.",tt17640714,5.9,110.0,"Horror, Thriller"
Hellraiser,2022,338947,6.2,"A young woman struggling with addiction comes into possession of an ancient puzzle box, unaware that its purpose is to summon the Cenobites, a group of sadistic supernatural beings from another dimension.",tt0887261,5.9,121.0,"Horror, Mystery, Thriller"
Fear of Rain,2021,599281,6.932,"A teenage girl living with schizophrenia begins to suspect her neighbor has kidnapped a child. Her parents try desperately to help her live a normal life, without exposing their own tragic secrets, and the only person who believes her is Caleb – a boy she isn’t even sure exists.",tt10037014,5.9,109.0,"Drama, Horror, Mystery"
Till Death,2021,672741,6.726,"After a romantic evening at their secluded lake house, a woman wakes up handcuffed to her dead husband. Trapped and isolated in the dead of winter, she must fight off hired killers to escape her late spouse's twisted plan.",tt11804152,5.9,88.0,Thriller
Caveat,2021,744746,6.244,A lone drifter suffering from partial memory loss accepts a job to look after a psychologically troubled woman in an abandoned house on an isolated island.,tt7917178,5.9,88.0,"Horror, Mystery, Thriller"
Orphan: First Kill,2022,760161,6.629,"After escaping from an Estonian psychiatric facility, Leena Klammer travels to America by impersonating Esther, the missing daughter of a wealthy family. But when her mask starts to slip, she is put against a mother who will protect her family from the murderous “child” at any cost.",tt11851548,5.9,99.0,"Crime, Drama, Horror"
Cobweb,2023,709631,6.489,"Eight year old Peter is plagued by a mysterious, constant tapping from inside his bedroom wall—one that his parents insist is all in his imagination. As Peter's fear intensifies, he believes that his parents could be hiding a terrible, dangerous secret and questions their trustworthiness.",tt9100018,5.9,88.0,"Horror, Mystery, Thriller"
The Boogeyman,2023,532408,6.403,"Still reeling from the tragic death of their mother, a teenage girl and her younger sister find themselves plagued by a sadistic presence in their house and struggle to get their grieving father to pay attention before it’s too late.",tt3427252,5.9,98.0,"Horror, Mystery, Thriller"
V/H/S/Beyond,2024,1190868,6.7,"The infinite playground of forbidden worlds and dangerous lifeforms offered by the sci-fi horror genre will lead to the biggest, maddest, bloodiest V/H/S ever.",tt32880932,5.9,114.0,"Horror, Sci-Fi, Thriller"
Spree,2020,653598,6.4,"Desperate for an online following, a rideshare driver has figured out a deadly plan to go viral and he will stop at nothing to get his five minutes of fame.",tt11394332,5.9,93.0,"Comedy, Crime, Horror"
Underwater,2020,443791,6.291,"After an earthquake destroys their underwater station, six researchers must navigate two miles along the dangerous, unknown depths of the ocean floor to make it to safety in a race against time.",tt5774060,5.9,95.0,"Action, Horror, Sci-Fi"
Candyman,2021,565028,6.0,"A Chicago artist's sanity starts to unravel, unleashing a terrifying wave of violence when he begins to explore the macabre history of the Candyman.",tt9347730,5.9,91.0,"Horror, Thriller"
Shut In,2022,629015,6.798,A young single mother is held captive along with her two children by a violent ex and must plot their escape before it’s too late.,tt10131024,5.8,89.0,Thriller
You'll Never Find Me,2023,1117321,6.101,"Patrick, a strange and lonely resident, lives in a mobile home at the back of an isolated caravan park. After a violent thunderstorm erupts, a mysterious young woman appears at his door, seeking shelter from the weather. The longer the night wears on and the more the young woman discovers about Patrick, the more difficult she finds it to leave. Soon she begins to question Patrick’s intentions, while Patrick begins to question his own grip on reality...",tt22023218,5.8,100.0,"Horror, Thriller"
Come Play,2020,571384,6.4,"A lonely young boy feels different from everyone else. Desperate for a friend, he seeks solace and refuge in his ever-present cell phone and tablet. When a mysterious creature uses the boy’s devices against him to break into our world, his parents must fight to save their son from the monster beyond the screen.",tt8004664,5.8,96.0,"Drama, Horror, Mystery"
The Babysitter: Killer Queen,2020,623491,6.4,"Two years after defeating a satanic cult led by his babysitter Bee, Cole's trying to forget his past and focus on surviving high school. But when old enemies unexpectedly return, Cole will once again have to outsmart the forces of evil.",tt11024272,5.8,101.0,"Comedy, Horror"
Hellhole,2022,1032950,6.144,"In a monastery cut off from the world, the monks run a clinic for the possessed. One day, a young policeman Marek comes to the convent. Posing as a clergyman, he penetrates monastic life and tries to explain the recent, mysterious disappearance of several tormented inmates. It turns out, however, that there is no way out of the monastery.",tt19724142,5.8,91.0,"Horror, Mystery"
Nocebo,2022,782936,6.1,A fashion designer suffers from a mysterious illness that puzzles her doctors and frustrates her husband until help arrives in the form of a Filipino carer who uses traditional folk healing to reveal a horrifying truth.,tt11212572,5.8,96.0,"Horror, Thriller"
Monolith,2023,1024721,6.1,"A desperate young journalist turns to podcasting to salvage her career, but her rush to make headlines leads her to an alien conspiracy.",tt18298588,5.8,94.0,"Drama, Mystery, Sci-Fi"
Valley of the Dead,2020,613093,6.2,"During the Spanish Civil War, sworn enemies must work together when they encounter flesh-eating zombies created in a Nazi experiment.",tt10127708,5.8,101.0,"Action, Comedy, Horror"
Las Leyendas: El Origen,2021,667276,8.251,"When a human baby crosses the Eternal Mirror, the portal between the living and the death opens its path to the beings from the underworld.",tt10431332,5.8,85.0,"Animation, Adventure, Comedy"
Unseen,2023,1067714,6.664,"Sam receives a call from Emily, a near blind woman who is running from her murderous ex in the woods. Can she survive using Sam as her eyes via video call?",tt17201166,5.8,76.0,"Horror, Thriller"
Crimes of the Future,2022,819876,6.052,"With his partner, a celebrity performance artist publicly showcases the metamorphosis of his organs in avant-garde performances. An investigator from the National Organ Registry obsessively tracks their movements, which is when a mysterious group is revealed... Their mission — to use the artist's notoriety to shed light on the next phase of human evolution.",tt14549466,5.8,107.0,"Drama, Horror, Sci-Fi"
I Saw the TV Glow,2024,858017,6.1,"Teenager Owen is just trying to make it through life in the suburbs when his classmate Maddy introduces him to a mysterious TV show — a vision of a supernatural world beneath their own. In the pale glow of the television, Owen’s view of reality begins to crack.",tt15574270,5.8,100.0,"Drama, Horror"
Don't Move,2024,1063877,6.354,"A grieving woman in a secluded forest encounters a killer who injects her with a paralytic drug. As her body shuts down, her fight for survival begins.",tt24807110,5.8,92.0,"Horror, Thriller"
See for Me,2022,825808,6.0,"When blind former Olympic skier Sophie Scott cat-sits in a secluded mansion, she gets caught in the crossfire of a home invasion scheme. She must rely on a sighted Army veteran via the See for Me app to help her survive the night.",tt11209212,5.8,92.0,"Crime, Drama, Horror"
Nightwatch: Demons Are Forever,2023,1029880,6.208,"Martin's daughter, Emma, takes up a night watch job to find out what happened to her parents almost thirty years ago. A meeting with Wörmer in his cell pulls the serial killer out of his coma and sets in motion a chain of fateful events.",tt6318608,5.8,118.0,"Horror, Mystery, Thriller"
Trap,2024,1032823,6.321,"A father and teen daughter attend a pop concert, where they realize they're at the center of a dark and sinister event.",tt26753003,5.8,105.0,"Crime, Horror, Mystery"
Antebellum,2020,627290,6.238,Successful author Veronica finds herself trapped in a horrifying reality and must uncover the mind-bending mystery before it's too late.,tt10065694,5.8,105.0,"Drama, Horror, Mystery"
Death Whisperer,2023,1134433,7.48,"When a remote village is plagued by a deadly curse, one brother must fight to save his family from a terrifying supernatural threat.",tt29609422,5.8,120.0,"Horror, Thriller"
Immaculate,2024,1041613,6.233,"An American nun embarks on a new journey when she joins a remote convent in the Italian countryside. However, her warm welcome quickly turns into a living nightmare when she discovers her new home harbours a sinister secret and unspeakable horrors.",tt23137390,5.8,89.0,"Horror, Thriller"
Nightbooks,2021,739990,6.119,"Alex, a boy obsessed with scary stories, is trapped by a witch in her modern, magical New York City apartment. His original hair-raising tales are the only thing keeping him safe as he desperately tries to find a way out of this twisted place.",tt10521144,5.8,103.0,"Family, Fantasy, Horror"
Old,2021,631843,6.331,A group of families on a tropical holiday discover that the secluded beach where they are staying is somehow causing them to age rapidly – reducing their entire lives into a single day.,tt10954652,5.8,108.0,"Drama, Horror, Mystery"
Silent Night,2021,664574,5.944,"Nell, Simon, and their boy Art are ready to welcome friends and family for what promises to be a perfect Christmas gathering. Perfect except for one thing: everyone is going to die.",tt11628854,5.8,92.0,"Comedy, Drama, Horror"
Army of the Dead,2021,503736,6.228,"Following a zombie outbreak in Las Vegas, a group of mercenaries take the ultimate gamble: venturing into the quarantine zone to pull off the greatest heist ever attempted.",tt0993840,5.8,148.0,"Action, Crime, Drama"
Bhool Bhulaiyaa 2,2022,695962,6.368,"When strangers Reet and Ruhan cross paths, their journey leads to an abandoned mansion and a dreaded spirit who has been trapped for eighteen years.",tt6455162,5.7,143.0,"Comedy, Horror"
Slash/Back,2022,934194,6.418,"In a remote Arctic community, a group of Inuit girls fight off an alien invasion, all while trying to make it to the coolest party in town.",tt9050310,5.7,86.0,"Adventure, Horror, Sci-Fi"
Good Boy,2022,983507,6.4,"Christian – a millionaire heir, meets Sigrid – a young student, on a dating app. They hit it off quickly, but there's only one problem: Christian lives with Frank, a man who dresses up and constantly acts like a dog.",tt19705884,5.7,76.0,"Horror, Thriller"
The Vanished,2020,718400,6.044,"A family vacation takes a terrifying turn when parents Paul and Wendy discover their young daughter has vanished without a trace. Stopping at nothing to find her, the search for the truth leads to a shocking revelation.",tt9794630,5.7,115.0,"Action, Crime, Horror"
Night Teeth,2021,669671,6.427,"A college student moonlighting as a chauffeur picks up two mysterious women for a night of party-hopping across LA. But when he uncovers their bloodthirsty intentions—and their dangerous, shadowy underworld—he must fight to stay alive.",tt10763820,5.7,107.0,"Action, Crime, Drama"
Rushed,2021,828305,7.0,"Barbara O’Brien, an Irish Catholic mother, has her life turned upside-down when her son, a freshman in college, is involved in a tragic hazing incident. Taking justice into her own hands, she travels across the country recording mothers who have lost sons to hazing in an effort to prove the university’s liability. When she is confronted by corruption and cover ups, she seeks revenge on the one person she finds truly responsible, proving that hell hath no fury like a mother scorned.",tt10430850,5.7,101.0,"Crime, Drama, Mystery"
Sea Fever,2020,507441,6.1,The crew of a West of Ireland trawler—marooned at sea—struggle for their lives against a growing parasite in their water supply.,tt2716382,5.7,95.0,"Drama, Horror, Mystery"
The Guest Room,2021,761830,5.966,"The morning Stella decides to take her own life, a stranger knocks at her door claiming the guest room he booked for the night. Surprised but charmed by this man who seems to know her very well, Stella decides to let him in. But when Sandro, the man who broke Stella's heart, joins them at home, this odd situation turns immediately into chaos.",tt13315340,5.7,101.0,"Drama, Horror, Thriller"
Sting,2024,1087388,6.3,"After raising an unnervingly talented spider in secret, 12-year-old Charlotte must face the truth about her pet and fight for her family's survival.",tt20112746,5.7,91.0,"Horror, Sci-Fi, Thriller"
Cuckoo,2024,869291,5.728,"After reluctantly moving to the German Alps with her father and his new family, Gretchen discovers that their new town hides sinister secrets, as she's plagued by strange noises and frightening visions of a woman pursuing her.",tt12349832,5.7,102.0,"Horror, Mystery, Thriller"
The Closet,2020,571625,7.201,"After moving into a new house, a young girl begins displaying strange and disturbing behavior until, one day, she disappears behind a closet. While the devastated father is left with no clue about his daughter's disappearance, an exorcist shows up to help.",tt11727052,5.7,97.0,"Horror, Mystery"
Resident Evil: Death Island,2023,1083862,7.3,"In San Francisco, Jill Valentine is dealing with a zombie outbreak and a new T-Virus, Leon Kennedy is on the trail of a kidnapped DARPA scientist, and Claire Redfield is investigating a monstrous fish that is killing whales in the bay. Joined by Chris Redfield and Rebecca Chambers, they discover the trail of clues from their separate cases all converge on the same location, Alcatraz Island, where a new evil has taken residence and awaits their arrival.",tt26674627,5.7,91.0,"Animation, Action, Horror"
Significant Other,2022,901385,6.0,"Ruth and Harry decide to take a romantic backpacking trip through the Pacific Northwest, but amongst the beautiful scenery, Ruth makes an unexpected discovery that sets her off on a strange, frightening new path. The couple aren't alone in the woods, and they might not be the same when they come out...if they come out.",tt15353964,5.7,84.0,"Drama, Horror, Mystery"
Sister Death,2023,955531,5.975,"Spain, 1949. Narcisa, a novice, arrives at an old convent, converted into a girls' school, to work as a teacher.",tt19175696,5.7,91.0,"Horror, Mystery"
The Boy Behind The Door,2020,741613,6.3,Bobby tries to save himself and his best friend when they are kidnapped on their way home from school.,tt10772662,5.7,88.0,"Horror, Mystery, Thriller"
The Watchers,2024,1086747,6.413,"A young artist gets stranded in an extensive, immaculate forest in western Ireland, where, after finding shelter, she becomes trapped alongside three strangers, stalked by mysterious creatures each night.",tt26736843,5.7,102.0,"Fantasy, Horror, Mystery"
Daddy's Head,2024,1089123,6.053,A boy and his stepmother fear for their safety after an eerie creature resembling the boy's recently deceased father visits them.,tt26682012,5.7,92.0,Horror
Die Alone,2024,1141182,5.833,"Lost in a world reclaimed by nature and overrun by mysterious creatures, Ethan, a young man with amnesia navigates the dangerous landscape in search of his lost love Emma.  His journey takes an unexpected turn when he encounters Mae, a hardened and eccentric survivor.  Together, Ethan and Mae face threats both human and otherwise before a fateful encounter with Kai unravels a secret that lies just beyond Ethan's fractured memory.",tt21097192,5.7,91.0,"Drama, Horror, Mystery"
Escape Room: Tournament of Champions,2021,585216,6.527,"Six people unwittingly find themselves locked in another series of escape rooms, slowly uncovering what they have in common to survive... and discovering they've all played the games before.",tt9844522,5.7,88.0,"Action, Adventure, Horror"
Monster Summer,2024,928480,6.561,"When a mysterious force begins to disrupt their big summer fun, Noah and his friends team up with a retired police detective to embark on a monstrous adventure to save their island.",tt3954936,5.7,97.0,"Adventure, Fantasy, Mystery"
SpongeBob Squarepants: Kreepaway Kamp,2024,1354627,7.133,"While at Kamp Koral for a reunion, SpongeBob and the gang are stalked by a mysterious figure lurking in the shadows as campers start disappearing one by one!",tt33404610,5.7,45.0,"Animation, Comedy, Family"
Goodnight Mommy,2022,814800,6.256,"When twin brothers arrive home to find their mother’s demeanor altered and face covered in surgical bandages, they begin to suspect the woman beneath the gauze might not be their mother.",tt9000184,5.7,92.0,"Crime, Drama, Horror"
Studio 666,2022,895744,5.942,"Legendary rock band Foo Fighters move into an Encino mansion steeped in grisly rock and roll history to record their much anticipated 10th album. Once in the house, Dave Grohl finds himself grappling with supernatural forces that threaten both the completion of the album and the lives of the band.",tt15374070,5.6,106.0,"Comedy, Horror, Music"
Glorious,2022,939914,5.866,"After a breakup, Wes ends up at a remote rest stop. He finds himself locked inside the bathroom with a mysterious figure speaking from an adjacent stall. Soon Wes realizes he is involved in a situation more terrible than he could imagine.",tt12724306,5.6,79.0,"Horror, Mystery, Thriller"
The Nun II,2023,968051,6.708,"In 1956 France, a priest is violently murdered, and Sister Irene begins to investigate. She once again comes face-to-face with a powerful evil.",tt10160976,5.6,110.0,"Horror, Mystery, Thriller"
Salem's Lot,2024,748230,6.175,Author Ben Mears returns to his childhood home of Jerusalem's Lot only to discover his hometown is being preyed upon by a bloodthirsty vampire.,tt10245072,5.6,114.0,"Horror, Thriller"
Gaia,2021,795853,5.938,"In the depths of an ancient forest, something has been growing. Something older than humanity itself, and perhaps greater too. When a park ranger discovers a man and his son living wild, she stumbles onto a secret that is about to change the world.",tt11881160,5.6,96.0,"Drama, Fantasy, Horror"
Son,2021,754934,6.004,"When a young boy contracts a mysterious illness, his mother must decide how far she will go to protect him from terrifying forces in her past.",tt5624466,5.6,98.0,"Horror, Thriller"
In a Violent Nature,2024,1214509,5.707,"The enigmatic resurrection, rampage, and retribution of an undead monster in a remote wilderness unleashes an iconic new killer after a locket is removed from a collapsed fire tower that entombed its rotting corpse.",tt30321146,5.6,94.0,"Drama, Horror, Thriller"
Ghosts of War,2020,608195,6.276,A group of World War II American soldiers encounter a supernatural enemy as they occupy a French castle previously under Nazi control.,tt6508228,5.6,94.0,"Fantasy, Horror, Thriller"
Stopmotion,2024,840889,6.359,"Ella Blake, a stop-motion animator struggling to control her demons after the loss of her overbearing mother, embarks upon the creation of a film that becomes the battleground for her sanity. As Ella’s mind starts to fracture, the characters in her project take on a life of their own.",tt14852624,5.6,93.0,"Horror, Thriller"
